{
  "schema": "boe.mtt.renormalized-bv-anchored-repair-semiflow.v1",
  "claim_id": "CBF.T39",
  "date": "2026-08-30",
  "status": "GLOBAL_IDENTITY_RADIAL_INTERTWINING_EXCLUDED_FOR_T35_LOGARITHMIC_QUANTUM_ACTION_IN_ALLOWED_LOCAL_ORBIT_POINTED_QJ1_AND_ACTION_JET_QJ2_ANCHORED_FORMAL_BV_FLOW_CONSTRUCTED_UNIQUELY_PHYSICAL_UPPER_SELECTION_FIXED_COUPLING_COMPLETION_AND_GRAVITATIONAL_QJ0_OPEN",
  "source_provenance": {
    "source_lock": "renormalized_bv_anchored_repair_semiflow_source_lock.json",
    "source_lock_sha256": "b8f08e6a7ae3ac27d58181e03adef6cd245d3ccfb41172627a400e2e893f83cd",
    "schema": "renormalized_bv_anchored_repair_semiflow_contract.schema.json",
    "schema_sha256": "0b187aef9c2f07ceb8c63d9149f1e5fe64b86cd1aee22c7250114768d76426b0",
    "theorem": "RenormalizedBVAnchoredRepairSemiflowAndGlobalIntertwiningNoGoTheorem_v1.md",
    "theorem_sha256": "eb25406a95a3316a0c7b98ef237ef94d0f0758fd50c4cfbf672f9c633de57c5a",
    "repositories": {
      "mtt-causal-base-constraint-fiber": "074336061a201a02eebcb595c6d329b396e92639",
      "mtt-qm-source-proof": "cd3c13b665d6712dd78655cf0d2007231f634065",
      "20 Mathematical Language Discovery Program - Closure Dynamics": "aafecf2201ab5573b63968175592062d91d10a0a",
      "beq-papers": "acc186524ca2eaf04c7761aee4c03187ec70e1f1",
      "mtt-sm-parity-closure": "774bd880893043d5bcede64ae49020303e3d5d66"
    },
    "kernel_model_sha256": "592ef16dc03ce2195113b53cc75f8bb638bd27c279590ed3f5575d11dee05db8",
    "source_inventory_hash": "e644fa2ce12eb9037ea837bcee38e59aca87dd17ec79702cd2a05693d37d96ad"
  },
  "quantum_bv_generator": {
    "semidensity_pushforward": "Psi_s(h,phi_IR)=integral_(L_s(h)) exp[-S_s(h,phi_IR,chi)/hbar] rho_s^(1/2)",
    "effective_action": "Gamma_s=-hbar log Psi_s",
    "radial_Ward_identity": "partial_h Gamma_s=<partial_h S_s-hbar partial_h log rho_s^(1/2)>+B_s/Psi_s",
    "raw_scale_generator": "beta_s^BV=beta_s^action+beta_s^measure+beta_s^determinant+beta_s^cycle",
    "action_term_included": true,
    "measure_term_included": true,
    "determinant_term_included": true,
    "cycle_boundary_term_included": true,
    "terms_must_cancel_only_in_total": true,
    "individual_termwise_vanishing_required": false,
    "repair_parameter_identified_with_RG_scale": false,
    "RG_scale_identified_with_Lorentzian_time": false,
    "scope": "local formal q79 charts and finite/gapped shell presentations; a fixed-coupling nonperturbative integral is not asserted"
  },
  "q79_source_coverage": {
    "local_formal_QME_scheme": true,
    "SP_renormalization_freedom": true,
    "graphwise_local_counterterm_recursion": true,
    "exact_RG_composition": true,
    "Lorentzian_QME_and_Ward_bridge": true,
    "active_local_domain_boundary_gluing": true,
    "finite_shell_free_BV_pushforward": true,
    "diffeomorphism_orbit_zero_BFV_flux": true,
    "diffeomorphism_orbit_determinant_transport": true,
    "common_determinant_phase_drops_from_positive_source_derivatives": true,
    "radial_background_change_is_a_diffeomorphism_presentation_orbit": false,
    "QME_is_a_radial_stationarity_identity": false,
    "physical_fixed_coupling_interacting_BV_pushforward": false,
    "uniform_interacting_cutoff_removal": false,
    "selected_global_interacting_state": false
  },
  "global_intertwining_no_go": {
    "scope": "identity radial projection, common radial metric at the T34/T35 tier, and the allowed local counterterm class span{1,h^2,h^4}",
    "fermion_log_term": "-kappa_F q4_* h^4 log(h^2/mu^2)",
    "fifth_derivative": "-48 kappa_F q4_*/h",
    "q4_star_exact_coefficients": {
      "rational": "356/27",
      "sqrt13": "25/27"
    },
    "q4_star_positive": true,
    "H_positive": true,
    "fifth_derivative_at_H_per_kappa_in_Lambda_minus_one_units": "-600.359271843292819897635151785554697068873903937370253865311439935410037632957172131565691",
    "fifth_derivative_at_H_is_nonzero": true,
    "allowed_counterterm_fifth_derivative": "0",
    "global_same_metric_gradient_equality_would_force_fifth_derivative_zero": true,
    "global_identity_radial_repair_intertwining_possible": false,
    "bare_tadpole_over_kappa_Lambda3": "-100.114483627430279588255506887696895827724576220833743543915782457764101035430506698860949",
    "bare_tadpole_is_nonzero": true,
    "nonlinear_field_redefinition_or_unsourced_metric_escape_excluded": false,
    "no_go_is_universal_beyond_declared_scope": false,
    "correct_replacement": "pointed fixed-point and tangent-flow intertwining through the first jet of the repair vector field"
  },
  "pointed_anchor_retraction": {
    "jet_map": "j_H^2 f=(f(H),f'(H),f''(H))",
    "local_counterterm_space": "C_even=span{1,h^2,h^4}",
    "determinant": "det(j_H^2|C_even)=16 H^3",
    "H_positive_makes_map_invertible": true,
    "counterterm_formula": {
      "a0": "b0-(5/8)H b1+(1/8)H^2 b2",
      "a2": "(3 b1-H b2)/(4H)",
      "a4": "(H b2-b1)/(8H^3)"
    },
    "C_H": "C_H[f]=a0+a2 h^2+a4 h^4",
    "R_H": "R_H=I-C_H",
    "identities": [
      "j_H^2 C_H=j_H^2",
      "j_H^2 R_H=0",
      "C_H^2=C_H",
      "R_H^2=R_H"
    ],
    "four_term_linearity": "R_H beta_BV=sum_X R_H beta_BV^X for X=action,measure,determinant,cycle",
    "witness": {
      "rational_anchor_H": "3/2",
      "components": {
        "action_insertion": {
          "polynomial_coefficients_ascending": [
            "2",
            "0",
            "3",
            "0",
            "5",
            "0",
            "7"
          ],
          "counterterm_coefficients_ascending": [
            "5231/64",
            "0",
            "-1653/16",
            "0",
            "209/4"
          ],
          "remainder_coefficients_ascending": [
            "-5103/64",
            "0",
            "1701/16",
            "0",
            "-189/4",
            "0",
            "7"
          ],
          "remainder_jet_0_1_2": [
            "0",
            "0",
            "0"
          ]
        },
        "measure_density": {
          "polynomial_coefficients_ascending": [
            "1",
            "0",
            "-2",
            "0",
            "4",
            "0",
            "-3"
          ],
          "counterterm_coefficients_ascending": [
            "-2123/64",
            "0",
            "697/16",
            "0",
            "-65/4"
          ],
          "remainder_coefficients_ascending": [
            "2187/64",
            "0",
            "-729/16",
            "0",
            "81/4",
            "0",
            "-3"
          ],
          "remainder_jet_0_1_2": [
            "0",
            "0",
            "0"
          ]
        },
        "determinant_density": {
          "polynomial_coefficients_ascending": [
            "0",
            "0",
            "5",
            "0",
            "-1",
            "0",
            "2"
          ],
          "counterterm_coefficients_ascending": [
            "729/32",
            "0",
            "-203/8",
            "0",
            "25/2"
          ],
          "remainder_coefficients_ascending": [
            "-729/32",
            "0",
            "243/8",
            "0",
            "-27/2",
            "0",
            "2"
          ],
          "remainder_jet_0_1_2": [
            "0",
            "0",
            "0"
          ]
        },
        "cycle_boundary": {
          "polynomial_coefficients_ascending": [
            "3",
            "0",
            "1",
            "0",
            "-4",
            "0",
            "1"
          ],
          "counterterm_coefficients_ascending": [
            "921/64",
            "0",
            "-227/16",
            "0",
            "11/4"
          ],
          "remainder_coefficients_ascending": [
            "-729/64",
            "0",
            "243/16",
            "0",
            "-27/4",
            "0",
            "1"
          ],
          "remainder_jet_0_1_2": [
            "0",
            "0",
            "0"
          ]
        }
      },
      "total_polynomial_coefficients_ascending": [
        "6",
        "0",
        "7",
        "0",
        "4",
        "0",
        "7"
      ],
      "total_jet_0_1_2": [
        "7791/64",
        "6303/16",
        "9481/8"
      ],
      "total_counterterm_coefficients_ascending": [
        "5487/64",
        "0",
        "-1589/16",
        "0",
        "205/4"
      ],
      "total_remainder_coefficients_ascending": [
        "-5103/64",
        "0",
        "1701/16",
        "0",
        "-189/4",
        "0",
        "7"
      ],
      "total_remainder_jet_0_1_2": [
        "0",
        "0",
        "0"
      ],
      "counterterm_is_linear_over_four_BV_terms": true,
      "retraction_is_linear_over_four_BV_terms": true,
      "retraction_is_idempotent": true,
      "matching_matrix_determinant": "16 H^3",
      "matching_matrix_determinant_at_witness": "54"
    }
  },
  "anchored_formal_bv_flow": {
    "raw_evolution": "partial_s Gamma_s=beta_s^BV(Gamma_s)",
    "anchored_evolution": "partial_s Gamma_s^H=R_H beta_s^BV(Gamma_s^H)",
    "initial_condition": "j_H^2 Gamma_0^H=j_H^2 P_*",
    "jet_conservation": "partial_s j_H^2 Gamma_s^H=0",
    "QJ1_formal_consequence": "partial_h Gamma_s^H(H)=0 at every formal order",
    "QJ2_formal_action_jet_consequence": "partial_h^2 Gamma_s^H(H)=partial_h^2 P_*(H)",
    "QJ2_metric_requirement_remaining": "the physical tangent metric or wave-function normalization at H",
    "QJ0_formal_action_jet_consequence": "Gamma_s^H(H)=P_*(H)",
    "formal_existence": "Costello graph recursion plus zero q79 anomaly gives an anchored coefficientwise solution at every finite perturbative bidegree",
    "formal_uniqueness": "for each raw coefficient and H>0, the three local coefficients are uniquely fixed by the three anchor equations",
    "composition": "the unique normalized anchored SP comparisons obey the scale cocycle; equivalently the extended (s,Gamma) evolution is a formal semiflow",
    "new_free_counterterm_coefficients": 0,